<?xml version="1.0" encoding="UTF-8" standalone="yes"?>
<i:intervals_request xmlns:i="com.intervals"
                       xmlns:xsi="http://www.w3.org/2001/XMLSchema-instance"
                       xsi:schemaLocation="com.intervals ../schema/request.xsd">
    <i:attendees>
        <i:id>Jack Slater</i:id>
        <i:id>Emil Rottmayer</i:id>
    </i:attendees>
    <i:meeting_duration_minutes>90</i:meeting_duration_minutes>
    <i:timeslots_needed>2</i:timeslots_needed>
    <i:seeking_range>
        <i:from>2015-11-03T13:00:00</i:from>
        <i:to>2015-11-03T15:00:00</i:to>
        <!-- timezone in terms of UTC time offset, for example -08:00 for PST, or +05:45 for Nepal time -->
        <i:timezone>+00:00</i:timezone>
    </i:seeking_range>
</i:intervals_request>